{
  "timestamp": "2026-04-27T00:13:42.051469+00:00",
  "git_commit": "df13715b",
  "hardware": {
    "interface": "UA-1000",
    "buffer_size": 64,
    "sample_rate": 48000,
    "cpu_cores": [
      4,
      5
    ]
  },
  "rtl": {
    "min_ms": 1160.655,
    "mean_ms": 1160.655,
    "p50_ms": 1160.655,
    "p95_ms": 1160.655,
    "p99_ms": 1160.655,
    "max_ms": 1160.655
  },
  "jitter": {
    "p95_ms": 0.0,
    "max_ms": 0.0
  },
  "xruns": 0,
  "gate": "FAIL",
  "notes": "method=jack; window_cycles=9000; converged_samples=31"
}
